{
    "status": 1,
    "domain_name": "linegp123.cc",
    "query_time": "2025-01-15 03:24:51",
    "whois_server": "whois.web.com",
    "domain_registered": "yes",
    "create_date": "2025-01-03",
    "update_date": "2025-01-03",
    "expiry_date": "2026-01-03",
    "domain_registrar": {
        "iana_id": 2254,
        "registrar_name": "Domain Name Root LLC",
        "whois_server": "whois.web.com",
        "website_url": "http://www.networksolutions.com",
        "email_address": "abuse@web.com",
        "phone_number": "+1.8003337680"
    },
    "name_servers": [
        "ns15.abovedomains.com",
        "ns16.abovedomains.com"
    ],
    "domain_status": [
        "ok"
    ],
    "raw_whois": "--------------------------------------------------\nGenerator: x2.autowhois.com\nRegistry WHOIS: ccwhois.verisign-grs.com\nQuery Time: Wed, 15 Jan 2025 03:24:51 +0000\n--------------------------------------------------\n\nDomain Name: LINEGP123.CC\r\nRegistry Domain ID: 203842500_DOMAIN_CC-VRSN\r\nRegistrar WHOIS Server: whois.web.com\r\nRegistrar URL: http://www.networksolutions.com\r\nUpdated Date: 2025-01-03T22:12:31Z\r\nCreation Date: 2025-01-03T09:02:50Z\r\nRegistry Expiry Date: 2026-01-03T09:02:50Z\r\nRegistrar: Domain Name Root LLC\r\nRegistrar IANA ID: 2254\r\nRegistrar Abuse Contact Email: abuse@web.com\r\nRegistrar Abuse Contact Phone: +1.8003337680\r\nDomain Status: ok https://icann.org/epp#ok\r\nName Server: NS15.ABOVEDOMAINS.COM\r\nName Server: NS16.ABOVEDOMAINS.COM\r\nDNSSEC: unsigned\r\nURL of the ICANN Whois Inaccuracy Complaint Form: https://www.icann.org/wicf/\r\n>>> Last update of WHOIS database: 2025-01-15T03:24:29Z <<<\r\n\r\nFor more information on Whois status codes, please visit https://icann.org/epp\r\n\r\nNOTICE: The expiration date displayed in this record is the date the\r\nregistrar's sponsorship of the domain name registration in the registry is\r\ncurrently set to expire. This date does not necessarily reflect the\r\nexpiration date of the domain name registrant's agreement with the\r\nsponsoring registrar.  Users may consult the sponsoring registrar's\r\nWhois database to view the registrar's reported date of expiration\r\nfor this registration.\r\n\r\nTERMS OF USE: You are not authorized to access or query our Whois\r\ndatabase through the use of electronic processes that are high-volume and\r\nautomated except as reasonably necessary to register domain names or\r\nmodify existing registrations; the Data in VeriSign's (\"VeriSign\") Whois\r\ndatabase is provided by VeriSign for information purposes only, and to\r\nassist persons in obtaining information about or related to a domain name\r\nregistration record. VeriSign does not guarantee its accuracy.\r\nBy submitting a Whois query, you agree to abide by the following terms of\r\nuse: You agree that you may use this Data only for lawful purposes and that\r\nunder no circumstances will you use this Data to: (1) allow, enable, or\r\notherwise support the transmission of mass unsolicited, commercial\r\nadvertising or solicitations via e-mail, telephone, or facsimile; or\r\n(2) enable high volume, automated, electronic processes that apply to\r\nVeriSign (or its computer systems). The compilation, repackaging,\r\ndissemination or other use of this Data is expressly prohibited without\r\nthe prior written consent of VeriSign. You agree not to use electronic\r\nprocesses that are automated and high-volume to access or query the\r\nWhois database except as reasonably necessary to register domain names\r\nor modify existing registrations. VeriSign reserves the right to restrict\r\nyour access to the Whois database in its sole discretion to ensure\r\noperational stability.  VeriSign may restrict or terminate your access to the\r\nWhois database for failure to abide by these terms of use. VeriSign\r\nreserves the right to modify these terms at any time."
}